ID,Title,Year,Year_Range,PrincipalName,PrincipalAffiliationName,Institution_Type,Institution_Sub,CenterName,FundTypeDesc,ProgramName,GoalText,Goal_3_v_4,AwardAmt,AwardPer,AwardNum,Status_Now,
878,Evaluating the Effectiveness of Preschool Literacy Curriculum for Children At-Risk,2003,2002-2006,"Lonigan, Christopher",Florida State University,Uni,Public,NCER,Grant,Preschool Curriculum Evaluation Research,Efficacy and Replication,3,"$1,675,653",4 years,R305J030093,Completed,
367,A Randomized Trial of Preschool Instructional Strategies to Improve School Performance and Reduce Use of Special Education,2006,2002-2006,"Lonigan, Christopher",Florida State University,Uni,Public,NCSER,Grant,Early Intervention and Early Learning in Special Education,Efficacy and Replication,3,"$3,299,598",6/1/2006 to 5/31/2010,R324E060086,Completed,
515,Child-Instruction Interactions in Reading: Examining Causal Effects of Individualized Instruction in Second and Third Grade,2007,2007-2011,"Connor, Carol M.",Florida State University,Uni,Public,NCER,Grant,Reading and Writing,Efficacy and Replication,3,"$3,000,000",4 years,R305B070074,Completed,
978,A Randomized Trial of the SCERTS Curriculum for Students with Autism Spectrum Disorders in Early Elementary School Classrooms,2010,2007-2011,"Wetherby, Amy",Florida State University,Uni,Public,NCSER,Grant,Autism Spectrum Disorders,Efficacy and Replication,3,"$2,999,364",03/01/2010 - 02/28/2014,R324A100174,Completed,
988,"Examining Effective Intervention Targets, Longitudinal Intensity, and Scaling Factors for Pre-K to 5th Grade Student Comprehension",2010,2007-2011,"Lonigan, Christopher",Florida State University,Uni,Public,NCER,Grant,Reading for Understanding Research Initiative,Multiple Goals,Multiple,"$20,000,000",5 years,R305F100027,Completed,
1188,A Randomized Controlled Trial of Student Success Skills: A Program to Improve Academic Achievement for All Students,2011,2007-2011,"Webb, Linda",Florida State University,Uni,Public,NCER,Grant,Social and Behavioral Context for Academic Learning,Efficacy and Replication,3,"$2,738,187",4 years,R305A120810,Completed,
1208,State Merit Aid Program and Student College Choice and Success: Evaluating the Efficacy of Florida's Bright Futures Program,2011,2007-2011,"Hu, Shouping",Florida State University,Uni,Public,NCER,Grant,Postsecondary and Adult Education,Efficacy and Replication,3,"$774,910",3 years,R305A110609,Completed,
1295,Replicating the CGI Experiment in Diverse Environments,2012,2012-2016,"Schoen, Robert",Florida State University,Uni,Public,NCER,Grant,Effective Instruction,Efficacy and Replication,3,"$3,427,187",4 years (9/01/2012-8/31/2016),R305A120781,Completed,
1791,Efficacy of the Core Knowledge Language Arts Read Aloud Program in Kindergarten through Second Grade Classrooms,2016,2012-2016,"Cabell, Sonia",Florida State University,Uni,Public,NCER,Grant,Reading and Writing,Efficacy and Replication,3,"$3,299,999",5 years (7/1/2016-6/30/2021),R305A170635,In field,
1798,Training-Induced Language and Literacy Improvement in Children with Cochlear Implants,2016,2012-2016,"Ingvalson, Erin",Florida State University,Uni,Public,NCSER,Grant,Cognition and Student Learning in Special Education,Efficacy and Replication,3,"$3,499,939",4 years (7/1/2016-6/30/2020),R324A160193,In field,
1822,Generating Large and Sustained Impacts on Early Language Skills: Evaluation of Timing and Duration of Intervention,2016,2012-2016,"Lonigan, Christopher",Florida State University,Uni,Public,NCER,Grant,Cognition and Student Learning,Efficacy and Replication,3,"$3,300,000",4 years (7/1/2016–6/30/2020),R305A160241,In field,
1850,Evaluation of Florida's Developmental Education Redesign,2016,2012-2016,"Hu, Shouping",Florida State University,Uni,Public,NCER,Grant,Postsecondary and Adult Education,Efficacy and Replication,3,"$3,283,265",5 years (7/1/2016-6/30/2021),R305A160166,In field,
2151,Efficacy of the Early Social Interaction (ESI) Model for Toddlers with Early Signs of Autism Spectrum Disorder in Community Early Intervention Programs,2018,2017-2019,"Wetherby, Amy",Florida State University,Uni,Public,NCSER,Grant,Early Intervention and Early Learning in Special Education,Efficacy and Replication,3,"$3,300,000",5 years (07/01/2018-06/30/2023),R324A180193,In field,
2195,Follow-up to the Replicating the CGI Experiment in Diverse Environments Study,2018,2017-2019,"Schoen, Robert",Florida State University,Uni,Public,NCER,Grant,Effective Instruction,Efficacy and Replication,3,"$1,100,000",2 years (07/01/2018 - 06/30/2020),R305A180429,In field,
1524,Testing the Integration of an Empirically-supported Teacher Consultation Model and a Social-emotional Learning and Literacy Intervention in Urban Elementary Schools,2014,2012-2016,"Brown, Joshua",Fordham University,Uni,Private,NCER,Grant,Social and Behavioral Context for Academic Learning,Efficacy and Replication,3,"$3,490,163",4 Years (9/1/2014-8/31/2018),R305A140559,Completed,
76,Increasing Learning By Promoting Early Abstract Thought,2003,2002-2006,"Pasnak, Robert",George Mason University,Uni,Private,NCER,Grant,Cognition and Student Learning,Efficacy and Replication,3,"$721,039",3 years,R305H030031,Completed,
475,An Economical Improvement In Literacy and Numeracy,2007,2007-2011,"Pasnak, Robert",George Mason University,Uni,Private,NCER,Grant,Cognition and Student Learning,Efficacy and Replication,3,"$684,666",2 years,R305B070542,Completed,
802,"Focusing on the Efficacy of Teaching Advanced Forms of Patterning on First Graders' Improvements in Reading, Mathematics, and Reasoning Ability",2009,2007-2011,"Pasnak, Robert",George Mason University,Uni,Private,NCER,Grant,Cognition and Student Learning,Efficacy and Replication,3,"$1,577,827",4 years,R305A090353,Completed,
2057,"Focusing on the Efficacy of Teaching Advanced Forms of Patterning on Kindergartners' Improvements in Literacy, Mathematics, and Reasoning Ability",2017,2017-2019,"Pasnak, Robert",George Mason University,Uni,Private,NCER,Grant,Cognition and Student Learning,Efficacy and Replication,3,"$1,621,738",3 years (07/01/2017 – 06/30/2020),R305A170114,In field,
154,Building Language for Literacy and Core Knowledge,2003,2002-2006,"Ramey, Sharon",Georgetown University,Uni,Private,NCER,Grant,Early Learning Programs and Policies,Efficacy and Replication,3,"$1,964,376",4 years,R305J030120,Completed,
1152,"The Impact of Incentives to Recruit and Retain Teachers in ""Hard-to-Staff"" Subjects: An Analysis of the Florida Critical Teacher Shortage Program",2011,2007-2011,"Sass, Tim",Georgia State University,Uni,Public,NCER,Grant,Improving Education Systems,Efficacy and Replication,3,"$495,575",3 years,R305A110967,Completed,
3288,PAWS: Efficacy,2019,2017-2019,"Puranik, Cynthia",Georgia State University,Uni,Public,NCER,Grant,Reading and Writing,Efficacy,3,"$3,209,379",5 Years (09/01/2019 - 08/31/2024),R305A190168,In field,
3311,Liberate,2019,2017-2019,"Houchins, David",Georgia State University,Uni,Public,NCSER,Grant,Special Topic: Systems-Involved Students with Disabilities,Efficacy,3,"$3,299,326",4 years (07/01/2019–06/30/2023),R324A190145,In field,
385,Multiple-Component Remediation for Struggling Middle School Readers,2006,2002-2006,"Morris, Robin","Georgia State University Research Foundation, Inc",Uni,Public,NCSER,Grant,"Reading, Writing, and Language Development",Efficacy and Replication,3,"$2,882,630",6/1/2006 to 5/31/2010,R324G060005,Completed,
824,Word Generation: An Efficacy Trial,2009,2007-2011,"Snow, Catherine",Harvard University,Uni,Private,NCER,Grant,Reading and Writing,Efficacy and Replication,3,"$2,853,512",4 years,R305A090555,Completed,
1538,Student Outcomes of Integrative Mental Health Services,2014,2012-2016,"Weisz, John",Harvard University,Uni,Private,NCER,Grant,Social and Behavioral Context for Academic Learning,Efficacy and Replication,3,"$3,499,669",4 years (8/1/2014-07/31/2018),R305A140253,Completed,
1560,Digital Messaging to Improve College Enrollment and Success,2014,2012-2016,"Avery, Chris",Harvard University,Uni,Private,NCER,Grant,Postsecondary and Adult Education,Efficacy and Replication,3,"$3,499,999",4 years (7/1/2014 – 6/30/2018),R305A140121,Completed,
2227,The National Center for Rural Education Research Networks (NCRERN),2019,2017-2019,"Kane, Thomas",Harvard University,Uni,Private,NCER,Grant,Education Research and Development Centers,Multiple Goals,Multiple,"$9,994,246",5 years (2/2/2019 – 1/31/2024),R305C1900004,In field,
1876,An Efficacy Trial of the Early Achievements Comprehensive Intervention for Preschoolers with Autism,2016,2012-2016,"Landa, Rebecca","Hugo W. Moser Research Institute at Kennedy Krieger, Inc.",Uni,Hospital,NCSER,Grant,Autism Spectrum Disorders,Efficacy and Replication,3,"$3,499,999",4 years (7/1/2016-6/30/2020),R324A160228,In field,
1576,An Experimental Design Evaluation of Full-Day Kindergarten,2005,2002-2006,"Plucker, Jonathan",Indiana University,Uni,Public,NCER,Grant,Field Initiated Evaluations of Education Innovations,Efficacy and Replication,3,"$802,421",4 years (7/1/2005-6/30/2009),R305F050256,Completed,
723,Testing the Effectiveness of CALM for High School Chemistry Students,2009,2007-2011,"Plucker, Jonathan",Indiana University,Uni,Public,NCER,Grant,"Science, Technology, Engineering, and Mathematics (STEM) Education",Efficacy and Replication,3,"$2,019,816",4 years,R305A090195,Completed,
1902,Testing the Efficacy of Embedded Social Skills within a Universal Classroom Management Program: Well-Managed Schools,2016,2012-2016,"Redmond, Cleve",Iowa State University of Science and Technology,Uni,Public,NCER,Grant,Social and Behavioral Context for Academic Learning,Efficacy and Replication,3,"$3,296,591",5 years (7/1/16-6/30/21),R305A160346,In field,
1568,"Evaluation of the Computer and Team-Assisted Mathematical Acceleration (CATAMA) Lab in Urban, High-Poverty, High-Minority Middle Schools",2005,2002-2006,"Balfanz, Robert",Johns Hopkins University,Uni,Private,NCER,Grant,Field Initiated Evaluations of Education Innovations,Efficacy and Replication,3,"$1,148,885",3 years (7/1/2005-6/30/2008),R305F050223,Completed,
495,Successful Transitions to Algebra 1: A Randomized Control Trial of Two Theories of Ninth Grade Algebra Instruction,2007,2007-2011,"Balfanz, Robert",Johns Hopkins University,Uni,Private,NCER,Grant,"Science, Technology, Engineering, and Mathematics (STEM) Education",Efficacy and Replication,3,"$2,478,127",4 years,R305B070508,Completed,
547,Testing The Impact of PBIS Plus,2007,2007-2011,"Leaf, Philip",Johns Hopkins University,Uni,Private,NCSER,Grant,Social and Behavioral Outcomes to Support Learning,Efficacy and Replication,3,"$2,849,197",5/1/2007 to 4/30/2011,R324A070118,Completed,
649,A Randomized Controlled Trial of the Combination of Two Preventive Interventions,2008,2007-2011,"Ialongo, Nicholas",Johns Hopkins University,Uni,Private,NCER,Grant,Social and Behavioral Context for Academic Learning,Efficacy and Replication,3,"$2,807,781",4 years,R305A080326,Completed,
1319,Getting Students to the Finish Line: An Efficacy Study of a Ninth Grade Early Warning Indicator Intervention,2012,2012-2016,"Balfanz, Robert",Johns Hopkins University,Uni,Private,NCER,Grant,Improving Education Systems,Efficacy and Replication,3,"$3,458,989",4 years (7/01/2012-6/30/2016),R305A120677,Completed,
1800,RAP Club: Improving Mental Health and School Performance in Urban Eighth Graders,2016,2012-2016,"Mendelson, Tamar",Johns Hopkins University,Uni,Private,NCER,Grant,Social and Behavioral Context for Academic Learning,Efficacy and Replication,3,"$3,274,545",5 years (7/1/2016-6/30/2021),R305A160082,In field,
2171,"A Regression Discontinuity Study of the Impact of ALFA Lab on 9th-Graders' Reading Achievement, Motivation, and Reading Frequency",2018,2017-2019,"Mac Iver, Douglas",Johns Hopkins University,Uni,Private,NCER,Grant,Reading and Writing,Efficacy and Replication,3,"$3,254,543.56",4 years (09/01/2018 - 08/31/2022),R305A180154,In field,
3355,Evaluating an Online System of Supports for the Good Behavior Game,2019,2017-2019,"Ialongo, Nicholas",Johns Hopkins University,Uni,Private,NCER,Grant,Social and Behavioral Context for Academic Learning,Efficacy,3,"$3,295,667",5 years (07/01/2019 - 06/30/2024),R305A190382,In field,
684,National Research and Development Center on Serious Behavior Disorders at the Secondary Level,2008,2007-2011,"Kern, Lee",Lehigh University,Uni,Private,NCSER,Grant,Special Education Research and Development Centers,Multiple Goals,Multiple,"$10,447,669",07/01/2008 - 06/30/2013,R324C080006,Completed,
357,"The New 3R's – Reading, Resilience, and Relationships in After-School Programs",2003,2002-2006,"Noam, Gil",McLean Hospital,Uni,Hospital,NCER,Grant,Unsolicited and Other Awards,Efficacy and Replication,3,"$1,000,000",2 years,R305W030036,Completed,
3284,"Evaluating Michigan's Early Literacy Law: Impacts, Implementation and Improving State Capacity",2019,2017-2019,"Strunk, Katharine",Michigan State University,Uni,Public,NCER,Grant,Evaluation of State and Local Education Programs and Policies,Efficacy,3,"$4,999,656",5 years (09/01/19 - 08/31/24),R305H190004,In field,
3357,Effect of a 9-Month Soft Skills and Work-Based Employment Training Program in Improving Transition Students’ Success: A Randomized Controlled Trial Study,2019,2017-2019,"Fisher, Marisa",Michigan State University,Uni,Public,NCSER,Grant,"Low-Cost, Short-Duration Evaluation of Special Education Interventions",Efficacy,3,"$249,927",2 years (08/16/2019 - 08/15/2021),R324L190002,In field,
1708,Improvement of Elementary Fractions Instruction: Randomized Controlled Trial Using Lesson Study with a Fractions Resource Kit,2015,2012-2016,"Lewis, Catherine",Mills College,Uni,Private,NCER,Grant,Effective Instruction,Efficacy and Replication,3,"$3,499,825",4 years (09/01/2015-08/31/2019),R305A150043,Completed,
874,"Reading, Writing, Respect and Resolution: The Impact of a Social and Character Development and Literacy Program on Teachers and Children",2003,2002-2006,"Aber, J. Lawrence",New York University,Uni,Private,NCER,Grant,Social and Character Development,Efficacy and Replication,3,"$2,369,900",4 years,R305L030003,Completed,
648,Testing the Efficacy of INSIGHTS in Enhancing the Academic Learning Context,2008,2007-2011,"McClowry, Sandra",New York University,Uni,Private,NCER,Grant,Social and Behavioral Context for Academic Learning,Efficacy and Replication,3,"$2,919,913",4 years,R305A080512,Completed,
905,Tools of the Mind: Promoting Self-Regulation and Academic Ability in Kindergarten,2010,2007-2011,"Blair, Clancy",New York University,Uni,Private,NCER,Grant,Cognition and Student Learning,Efficacy and Replication,3,"$3,521,227",4 years,R305A100058,Completed,
1873,Does Early Intervention Benefit Social-Emotional and Academic Development in Middle School? A Follow-up Study of INSIGHTS,2016,2012-2016,"O'Connor, Erin",New York University,Uni,Private,NCER,Grant,Social and Behavioral Context for Academic Learning,Efficacy and Replication,3,"$1,094,603",3 years (9/1/2016-8/31/2019),R305A160177,In field,
1985,Strengthening School Readiness through Pre-K for All: A University-District Partnership,2017,2017-2019,"Morris, Pamela",New York University,Uni,Private,NCER,Grant,Evaluation of State and Local Education Programs and Policies,Efficacy,3,"$4,968,839",5 years (9/1/17 – 8/31/22),R305H170042,In field,
2032,"Assessing the Implementation, Impact & Variation of CTE Innovation: NYC as a Lab for Rigorous CTE Research",2017,2017-2019,"Kemple, James",New York University,Uni,Private,NCER,Grant,Career and Technical Education,Efficacy and Replication,3,"$3,118,343",4 years (09/01/2017 - 08/31/2021),R305A170498,In field,
1569,"Promoting School Success in Children Attending Pre-K Programs in Poor, Urban Schools",2005,2002-2006,"Brotman, Laurie",New York University School of Medicine,Uni,Hospital,NCER,Grant,Field Initiated Evaluations of Education Innovations,Efficacy and Replication,3,"$3,849,787",6 years (6/1/2005-5/31/2011),R305F050245,Completed,
1023,Academic Achievement Outcomes from a Pre-K Family and School Intervention,2010,2007-2011,"Brotman, Laurie",New York University School of Medicine,Uni,Hospital,NCER,Grant,Social and Behavioral Context for Academic Learning,Efficacy and Replication,3,"$2,127,642",4 years,R305A100596,Completed,
1471,Efficacy Follow-up of ParentCorps: Long-term Impact of Early Childhood Family-Focused Intervention on Academic Achievement,2014,2012-2016,"Brotman, Laurie",New York University School of Medicine,Uni,Hospital,NCER,Grant,Social and Behavioral Context for Academic Learning,Efficacy and Replication,3,"$1,200,000",3 Years (7/1/2014-6/30/2017),R305A140298,Completed,
581,The Effects of Disadvantaged Schools and Neighborhoods on the Education of Low-Income Youth,2007,2007-2011,"Duncan, Greg",Northwestern University,Uni,Private,NCER,Grant,Unsolicited and Other Awards,Efficacy and Replication,3,"$600,000",3 years,R305U070006,Completed,
920,Learning Leadership: Kernel Routines for Instructional Improvement,2010,2007-2011,"Spillane, James",Northwestern University,Uni,Private,NCER,Grant,Education Leadership,Efficacy and Replication,3,"$3,345,497",4 years,R305A100289,Not completed,Project ended early due to recruitment challenges
1026,Preventing Truancy in Urban Schools Through Provision of School Services by Truancy Officers,2010,2007-2011,"Guryan, Jonathan",Northwestern University,Uni,Private,NCER,Grant,Improving Education Systems,Efficacy and Replication,3,"$3,177,638",4 years,R305A120809,Completed,
1889,Contexts Inside and Outside of School Walls as Predictors of Differential Effectiveness in Preschool Professional Development,2016,2012-2016,"Sabol, Terri",Northwestern University,Uni,Private,NCER,Grant,Early Learning Programs and Policies,Efficacy and Replication,3,"$699,490",3 years (9/1/2016-8/31/2019),R305A160013,In field,
180,Print Referencing Efficacy,2005,2002-2006,"Justice, Laura",Ohio State University,Uni,Public,NCER,Grant,Reading and Writing,Efficacy and Replication,3,"$2,626,659",4 years,R305G050005,Completed,
110,Classroom Connectivity in Promoting Mathematics and Science Achievement,2005,2002-2006,"Owens, Douglas",Ohio State University,Uni,Public,NCER,Grant,"Science, Technology, Engineering, and Mathematics (STEM) Education",Efficacy and Replication,3,"$2,995,261",4 years,R305K050045,Completed,
1573,Efficacy of Conversational Responsiveness Preschool Intervention,2005,2002-2006,"Justice, Laura",Ohio State University,Uni,Public,NCER,Grant,Field Initiated Evaluations of Education Innovations,Efficacy and Replication,3,,5 years (9/1/2005-5/31/2010),R305F050006,Completed,
619,Sit Together and Read: Early Childhood Special Education,2008,2007-2011,"Justice, Laura",Ohio State University,Uni,Public,NCSER,Grant,Early Intervention and Early Learning in Special Education,Efficacy and Replication,3,"$3,866,519",6/1/2008 to 5/31/2012,R324A080037,Completed,
657,Efficacy of Read It Again! In Rural Preschool Settings,2008,2007-2011,"Justice, Laura",Ohio State University,Uni,Public,NCER,Grant,Early Learning Programs and Policies,Efficacy and Replication,3,"$3,073,485",4 years,R305A080459,Completed,
989,The Language Bases of Reading Comprehension,2010,2007-2011,"Justice, Laura",Ohio State University,Uni,Public,NCER,Grant,Reading for Understanding Research Initiative,Multiple Goals,Multiple,"$19,999,999",5 years,R305F100002,Completed,
1421,Read It Again! In Early Childhood Special Education,2013,2012-2016,"Justice, Laura",Ohio State University,Uni,Public,NCSER,Grant,Early Intervention and Early Learning in Special Education,Efficacy and Replication,3,"$3,500,000",7/1/13–6/30/17,R324A130066,Completed,
1730,Enhancing Middle School Mathematics Achievement through Spatial Skills Instruction,2015,2012-2016,"Sorby, Sheryl",Ohio State University,Uni,Public,NCER,Grant,Cognition and Student Learning,Efficacy and Replication,3,"$3,499,941",4 years (7/1/2015-6/30/2019),R305A170640,Completed,
1803,Efficacy of the BrightStart! Program for Promoting Emergent Literacy Skills of PreKindergarten Children at Risk for Reading Difficulties,2016,2012-2016,"Piasta, Shayne",Ohio State University,Uni,Public,NCER,Grant,Early Learning Programs and Policies,Efficacy and Replication,3,"$3,299,903",5 years (7/1/2016-6/30/2021),R305A160261,In field,
2189,Causal Effects of the Kindergarten Transition Intervention,2018,2017-2019,"Justice, Laura",Ohio State University,Uni,Public,NCER,Grant,Early Learning Programs and Policies,Efficacy and Replication,3,"$3,299,995",4 years (07/01/2018 - 06/30/2022),R305A180004,In field,
1043,Evaluation of the Effectiveness of the Ohio Department of Education's Literacy Core Curriculum for Early Childhood Educators,2010,2007-2011,"Piasta, Shayne",Ohio State University Research Foundation,Uni,Public,NCER,Grant,Evaluation of State and Local Education Programs and Policies,Efficacy,3,"$5,998,358",5 years,R305E100030,Completed,
1487,Multisite Study of School-Based Treatment Approaches for Adolescents with ADHD,2014,2012-2016,"Evans, Steven",Ohio University,Uni,Public,NCER,Grant,Social and Behavioral Context for Academic Learning,Efficacy and Replication,3,"$3,052,601",4 years (9/1/2014-8/31/2018),R305A140356,Completed,
3326,"Examining Outcomes of a Multi-Component, Individually Tailored Consultation Process Focused on Classroom Management for Teachers (K-5)",2019,2017-2019,"Owens, Julie",Ohio University,Uni,Public,NCSER,Grant,Social and Behavioral Outcomes to Support Learning,Efficacy,3,"$3,297,119",4 years (09/01/2019–08/31/2024),R324A190154,In field,
873,Positive Action for Social and Character Development,2003,2002-2006,"Flay, Brian",Oregon State University,Uni,Public,NCER,Grant,Social and Character Development,Efficacy and Replication,3,"$1,928,084",4 years,R305L030004,Completed,
613,The Chicago Social and Character Development Trial: Extension to Grade 8,2008,2007-2011,"Flay, Brian",Oregon State University,Uni,Public,NCER,Grant,Social and Behavioral Context for Academic Learning,Efficacy and Replication,3,"$2,993,222",4 years,R305A080253,Completed,
612,"Efficacy and Replication Research on the Intelligent Tutoring System for the Structure Strategy—Rural and Suburban Schools Grades 4, 5, 7, and 8",2008,2007-2011,"Wijekumar, Kausalai",Pennsylvania State University,Uni,Public,NCER,Grant,Reading and Writing,Efficacy and Replication,3,"$2,999,932",4 Years,R305A080133,Completed,
846,"The Social Skills Improvement System Classwide Intervention Program: Social, Behavioral, and Academic Outcomes in Elementary School",2009,2007-2011,"DiPerna, James",Pennsylvania State University,Uni,Public,NCER,Grant,Social and Behavioral Context for Academic Learning,Efficacy and Replication,3,"$2,412,860",4 years,R305A090438,Completed,
1751,Intervening with Children Experiencing Serious Peer Difficulties: The Friendship Connections Program,2015,2012-2016,"Bierman, Karen L.",Pennsylvania State University,Uni,Public,NCER,Grant,Social and Behavioral Context for Academic Learning,Efficacy and Replication,3,"$3,499,996",4 years (7/1/2015-6/30/2019),R305A150488,Completed,
2015,Effectiveness of the Social Skills Improvement System Classwide Intervention Program (SSIS-CIP) in the Primary Grades,2017,2017-2019,"DiPerna, James",Pennsylvania State University,Uni,Public,NCER,Grant,Social and Behavioral Context for Academic Learning,Effectiveness,4,"$3,799,833",4 years (07/01/2017–06/30/2021),R305A170047,In field,
391,Project Success: Improving the Educational Outcomes of Youth with Disabilities in Foster Care,2006,2002-2006,"Powers, Laurie",Portland State University,Uni,Public,NCSER,Grant,Transition Outcomes for Secondary Students with Disabilities,Efficacy and Replication,3,"$1,816,782",6/1/2006 to 5/31/2010,R324S060043,Completed,
781,Comprehensive Autism Program using Strategies for Teaching based on Autism Research,2009,2007-2011,"Young, Helen",Portland State University,Uni,Public,NCSER,Grant,Autism Spectrum Disorders,Efficacy and Replication,3,"$2,561,416",04/01/2009 - 03/31/2013,R324A090094,Completed,
971,My Life: Evaluation of Self-Determination Enhancement for Transitioning Students in Special Education and Foster Care,2010,2007-2011,"Geenen, Sarah",Portland State University,Uni,Public,NCSER,Grant,Transition Outcomes for Secondary Students with Disabilities,Efficacy and Replication,3,"$2,932,504",06/01/2010 – 05/31/2014,R324A100166,Completed,
2190,Efficacy of MindUP on Pre-Kindergarteners' Development of Social-Emotional Learning Competencies and Academic Skills,2018,2017-2019,"Mashburn, Andrew",Portland State University,Uni,Public,NCER,Grant,Early Learning Programs and Policies,Efficacy and Replication,3,"$3,300,000",5 years (07/01/2018 - 06/30/2023),R305A180374,In field,
1305,Doubling Up? The Impact of Remedial Algebra on Students' Long-Run Outcomes,2012,2012-2016,"Goodman, Joshua",President and Fellows of Harvard College,Uni,Private,NCER,Grant,Improving Education Systems,Efficacy and Replication,3,"$291,164",1 year (7/1/2012-6/30/2013),R305A120466,Completed,
711,Increasing Opportunities-to-Learn in Urban Middle Schools,2008,2007-2011,"Lesaux, Nonie","President and Fellows of Harvard College, Graduate School of Education",Uni,Private,NCER,Grant,Reading and Writing,Efficacy and Replication,3,"$640,544",3 years,R305A080631,Completed,
746,Preparing to Succeed: An Efficacy Trial of Two Early Childhood Curricula,2009,2007-2011,"Yoshikawa, Hirokazu","President and Fellows of Harvard College, Graduate School of Education",Uni,Private,NCER,Grant,Early Learning Programs and Policies,Efficacy and Replication,3,"$1,126,997",2 years,R305A090209,Completed,
