ID,Title,Year,Year_Range,PrincipalName,PrincipalAffiliationName,Institution_Type,Institution_Sub,CenterName,FundTypeDesc,ProgramName,GoalText,Goal_3_v_4,AwardAmt,AwardPer,AwardNum,Status_Now,
956,Intended and Unintended Consequences of State High-Stakes Testing: Evidence from Standards-Based Reform in Massachusetts,2010,2007-2011,"Murnane, Richard","President and Fellows of Harvard College, Graduate School of Education",Uni,Private,NCER,Grant,Evaluation of State and Local Education Programs and Policies,Efficacy,3,"$450,000",3 years,R305E100013,Completed,
884,Impact of the Project Approach on Children's School Readiness and School Achievement,2002,2002-2006,"Powell, Douglas",Purdue University,Uni,Private,NCER,Grant,Preschool Curriculum Evaluation Research,Efficacy and Replication,3,"$944,028",4 years,R305J020027,Completed,
1161,Learning of Ratio and Proportion Problem-Solving Using Schema-Based Instruction: Efficacy and Sustainability,2011,2007-2011,"Jitendra, Asha",Regents of the University of Minnesota,Uni,Public,NCER,Grant,"Science, Technology, Engineering, and Mathematics (STEM) Education",Efficacy and Replication,3,"$4,593,808",4 years,R305A110358,Completed,
1975,Efficacy of Paraprofessional Behavior Support Coaching for Elementary School Students with Externalizing Behavior Disorders,2017,2017-2019,"Reddy, Linda",Rutgers University,Uni,Public,NCSER,Grant,Professional Development for Educators and School-Based Service Providers,Efficacy and Replication,3,"$3,299,279",4 years (7/1/2017-6/30/2021),R324A170069,In field,
1959,Doubling Up? Understanding the Long-Term Effects of Ninth-grade Algebra Reform on College Persistence and Graduation,2017,2017-2019,"Nomi, Takako",Saint Louis University,Uni,Private,NCER,Grant,Postsecondary and Adult Education,Efficacy and Replication,3,"$559,485",2 years (07/01/2017-06/30/2019),R305A170602,In field,
3331,Examining the Efficacy of Project ImPACT for Toddlers,2019,2017-2019,"Rieth, Sarah",San Diego State University,Uni,Public,NCSER,Grant,Early Intervention and Early Learning in Special Education,Efficacy,3,"$3,294,557",4 years (07/01/2019-06/30/2023),R324A190076,In field,
1605,Implementing an emergent literacy program for students with intellectual disabilities and autism in general education classrooms,2015,2012-2016,"Hunt, Pamela",San Francisco State University,Uni,Public,NCSER,Grant,"Reading, Writing, and Language Development",Efficacy and Replication,3,"$2,750,825",3 years (9/1/2015-8/31/2018),R324A150021,Completed,
360,Scaling-up Effective Intervention for Preventing Reading Difficulties in Young Children,2003,2002-2006,"Mathes, Patricia",Southern Methodist University,Uni,Private,NCER,Grant,Reading and Writing,Scale-Up Evaluations,4,"$5,999,744",5 years,R305W030257,Completed,
635,Closing the Achievement Gap in Middle School Mathematics Utilizing Stanford University's Education Program for Gifted Youth Differentiated Mathematics Program,2008,2007-2011,"Suppes, Patrick",Stanford University,Uni,Private,NCER,Grant,"Science, Technology, Engineering, and Mathematics (STEM) Education",Efficacy and Replication,3,"$2,996,641",4 years,R305A080464,Completed,
1387,Beyond Triage: A Randomized Experiment in Sustained Pre-College Advising,2013,2012-2016,"Bettinger, Eric",Stanford University,Uni,Private,NCER,Grant,Evaluation of State and Local Education Programs and Policies,Efficacy,3,"$1,705,221",4 years (7/01/2013-6/30/2017),R305E130009,Completed,
1663,A Scalable Growth Mindset Intervention to Raise Achievement and Persistence in Community College,2015,2012-2016,"Walton, Gregory",Stanford University,Uni,Private,NCER,Grant,Postsecondary and Adult Education,Efficacy and Replication,3,"$3,410,421",4 years (9/1/2015-8/31/2019),R305A150253,Completed,
312,Academic and Behavioral Competencies Model,2003,2002-2006,"Pelham, William","State University of New York (SUNY), Buffalo",Uni,Public,NCER,Grant,Social and Character Development,Efficacy and Replication,3,"$1,724,727",4 years,R305L030065,Completed,
1454,Scaling Up TRIAD: Teaching Early Mathematics for Understanding with Trajectories and Technologies,2005,2002-2006,"Clements, Douglas","State University of New York (SUNY), Buffalo",Uni,Public,NCER,Grant,"Science, Technology, Engineering, and Mathematics (STEM) Education",Scale-Up Evaluations,4,"$5,969,077",5 years,R305K050157,Completed,
2167,Enhancing IEPs of Children with ADHD Using Daily Report Cards: An Efficacy Trial,2018,2017-2019,"Fabiano, Gregory","State University of New York (SUNY), Buffalo",Uni,Public,NCSER,Grant,Social and Behavioral Outcomes to Support Learning,Efficacy and Replication,3,"$3,290,517",4 Years (09/01/2018-08/31/2022),R324A180175,In field,
352,A one-year follow-up of evidence-based early reading intervention provided by kindergarten and first grade teachers,2005,2002-2006,"Blachman, Benita",Syracuse University,Uni,Private,NCER,Grant,Reading and Writing,Efficacy and Replication,3,"$199,897",2 years,R305U050002,Completed,
1848,Financial Aid Nudges: A National Experiment to Increase Retention of Financial Aid and College Persistence,2016,2012-2016,"Goldrick-Rab, Sara",Temple University,Uni,Private,NCER,Grant,Postsecondary and Adult Education,Efficacy and Replication,3,"$2,175,114",5 years (7/1/2016-6/30/2021),R305A160400,In field,
370,Project Early Reading Intervention,2006,2002-2006,"Simmons, Deborah",Texas A & M Research Foundation,Uni,Public,NCSER,Grant,Early Intervention and Early Learning in Special Education,Efficacy and Replication,3,"$2,885,628",6/1/2006 to 5/31/2010,R324E060067,Completed,
651,A Randomized Control Trial to Assess the Efficacy of the Balanced Leadership Program,2008,2007-2011,"Goddard, Roger",Texas A & M University,Uni,Public,NCER,Grant,Education Leadership,Efficacy and Replication,3,"$2,989,775",4 years,R305A080696,Completed,
1660,Efficacy and Replication Trial of the Individualized Adaptive ITSS with 4th and 5th Grade Students in High Poverty Schools,2015,2012-2016,"Wijekumar, Kausalai",Texas A & M University,Uni,Public,NCER,Grant,Reading and Writing,Efficacy and Replication,3,"$3,499,570",4 years (8/1/2015-7/31/2019),R305A150057,Completed,
2157,Efficacy Trial of Text Structure Strategy Instruction on the Web for Spanish-Speaking English Learners (SWELL) in Grades 4 and 5,2018,2017-2019,"Wijekumar, Kausalai",Texas A & M University,Uni,Public,NCER,Grant,English Learners,Efficacy and Replication,3,"$3,298,201",4 years (07/01/2018–06/30/2022),R305A180060,In field,
2180,Efficacy Trial of the We-Write Intervention with 4th- and 5th-Grade Students,2018,2017-2019,"Wijekumar, Kausalai",Texas A & M University,Uni,Public,NCER,Grant,Reading and Writing,Efficacy and Replication,3,"$3,299,952",4 years (07/01/2018 - 06/30/2022),R305A180212,In field,
1446,Testing the Promise: A Randomized Trial of a Promise College Scholarship for Urban Public School Students,2013,2012-2016,"Harris, Douglas N.",The Administrators of the Tulane Educational Fund,Uni,Private,NCER,Grant,Improving Education Systems,Efficacy and Replication,3,"$3,037,937",4 years (8/1/13-7/31/17),R305A130044,Completed,
1275,Investigation of the Efficacy of the JUMP Program of Mathematics Instruction,2012,2012-2016,"Tannock, Rosemary",The Hospital for Sick Children,Uni,Hospital,NCER,Grant,"Science, Technology, Engineering, and Mathematics (STEM) Education",Efficacy and Replication,3,"$2,749,546",4 years (3/1/2012-2/29/2016),R305A120184,Completed,
1335,Joint Attention Mediated Learning Intervention for Toddlers with Autism Spectrum Disorders and Their Families,2012,2012-2016,"Schertz, Hannah",Trustees of Indiana University,Uni,Public,NCSER,Grant,Early Intervention and Early Learning in Special Education,Efficacy and Replication,3,"$3,499,713",7/1/12 – 6/30/16,R324A120291,Completed,
729,An Efficacy Study of Two Computer-Based Attention Training Systems in Schools,2009,2007-2011,"Steiner, Naomi",Tufts Medical Center,Uni,Hospital,NCER,Grant,Cognition and Student Learning,Efficacy and Replication,3,"$2,088,256",4 years,R305A090100,Completed,
882,A Longitudinal Study of the Effects of a Pre-Kindergarten Mathematics Curriculum on Low-Income Children's Mathematical Knowledge,2002,2002-2006,"Starkey, Prentice","University of California, Berkeley",Uni,Public,NCER,Grant,Preschool Curriculum Evaluation Research,Efficacy and Replication,3,"$2,607,653",4 years,R305J020026,Completed,
2090,A Longitudinal Study of the Effectiveness of a Pre-K Multisensory Literacy Curriculum,2003,2002-2006,"Cunningham, Anne","University of California, Berkeley",Uni,Public,NCER,Grant,Preschool Curriculum Evaluation Research,Efficacy and Replication,3,"$2,182,828",4 years,R305J030037,Completed,
1038,Ready or Not? California's Early Assessment Program and the Transition to College,2010,2007-2011,"Kurlaender, Michal","University of California, Davis",Uni,Public,NCER,Grant,Postsecondary and Adult Education,Efficacy and Replication,3,"$1,831,608",4 years,R305A100971,Completed,
1251,Examining the Efficacy of Classroom Pivotal Response Teaching in Classroom Environments,2012,2012-2016,"Stahmer, Aubyn","University of California, Davis",Uni,Public,NCSER,Grant,Autism Spectrum Disorders,Efficacy and Replication,3,"$2,545,268",6/1/2012 – 5/31/2016,R324A140005,Completed,
1760,California's College and Career Readiness Standards in the Era of Common Core Assessments,2015,2012-2016,"Kurlaender, Michal","University of California, Davis",Uni,Public,NCER,Grant,Evaluation of State and Local Education Programs and Policies,Efficacy,3,"$4,974,387",5 years (8/1/15-7/31/20),R305E150006,In field,
1626,Paths 2 the Future: Testing the Efficacy of a Career Development Intervention for High School Girls with Disabilities,2015,2012-2016,"Lindstrom, Lauren","University of California, Davis",Uni,Public,NCSER,Grant,Transition Outcomes for Secondary Students with Disabilities,Efficacy and Replication,3,"$3,499,674",4 years (7/1/2015-6/30/2019),R324A170148,Completed,
2051,Testing the Efficacy of the Academic Language and Literacy in Every Subject (ALLIES) Professional Learning Program,2017,2017-2019,"O'Hara, Susan","University of California, Davis",Uni,Public,NCER,Grant,Effective Instruction,Efficacy and Replication,3,"$3,230,920",5 years (07/01/2017 - 06/30/2022),R305A170316,In field,
2135,Evaluating Incentives for Full-time Enrollment at California Community Colleges,2018,2017-2019,"Martorell, Francisco E.","University of California, Davis",Uni,Public,NCER,Grant,Postsecondary and Adult Education,Efficacy and Replication,3,"$3,300,000",5 years (09/01/2018 – 08/31/2023),R305A180227,In field,
330,The Pathway Project: A Cognitive Strategies Approach to Reading and Writing Instruction for Teachers of Secondary English Language Learners,2006,2002-2006,"Olson, Carol","University of California, Irvine",Uni,Public,NCER,Grant,Effective Instruction,Efficacy and Replication,3,"$2,942,842",4 years,R305W060016,Completed,
830,Spatial Temporal Mathematics at Scale: An Innovative and Fully-Developed Paradigm to Boost Math Achievement Among All Learners,2009,2007-2011,"Farkas, George","University of California, Irvine",Uni,Public,NCER,Grant,"Science, Technology, Engineering, and Mathematics (STEM) Education",Efficacy and Replication,3,"$3,000,000",4 years,R305A090527,Completed,
1667,Digital Scaffolding for English Language Arts,2015,2012-2016,"Warschauer, Mark","University of California, Irvine",Uni,Public,NCER,Grant,Education Technology,Efficacy and Replication,3,"$3,500,000",4 years (7/1/2015-6/30/2019),R305A150429,Completed,
1929,"It's Worth It! Securing Persistence, Performance and Progress within Postsecondary Gateway Science Courses through Utility Value Interventions",2017,2017-2019,"Eccles, Jacquelynne","University of California, Irvine",Uni,Public,NCER,Grant,Postsecondary and Adult Education,Efficacy and Replication,3,"$2,740,650",4 years (7/1/2017-6/30/2021),R305A170160,In field,
630,National Research & Development Center on Instructional Technology: Center for Advanced Technology in Schools,2008,2007-2011,"Baker, Eva","University of California, Los Angeles",Uni,Public,NCER,Grant,Education Research and Development Centers,Multiple Goals,Multiple,"$9,833,451",5 years,R305C080015,Completed,
1281,Perceptual Learning Technology in Mathematics Education: Efficacy and Replication,2012,2012-2016,"Kellman, Philip","University of California, Los Angeles",Uni,Public,NCER,Grant,Cognition and Student Learning,Efficacy and Replication,3,"$1,991,881",4 years (7/1/2012-6/30/2016),R305A120288,Completed,
908,Interactions Between Visual and Auditory Interventions for Reading,2010,2007-2011,"Cottrell, Garrison","University of California, San Diego",Uni,Public,NCER,Grant,Cognition and Student Learning,Efficacy and Replication,3,"$2,372,289",4 years (3/1/2010–2/28/2014),R305A100389,Completed,
3264,A Lottery-Based Evaluation of the Impact of Public School Choice Programs on Short- and Medium-Term Academic and Behavioral Outcomes,2019,2017-2019,"Betts, Julian","University of California, San Diego",Uni,Public,NCER,Grant,Improving Education Systems,Efficacy,3,"$699,985",3 years (07/01/2019 – 06/30/2022),R305A190123,In field,
1355,Efficacy of the Collaborative Life Skills Program,2012,2012-2016,"Pfiffner, Linda","University of California, San Francisco",Uni,Public,NCSER,Grant,Social and Behavioral Outcomes to Support Learning,Efficacy and Replication,3,"$3,386,497",7/1/2012-6/30/2016,R324A120358,Completed,
343,Can Literacy Professional Development be Improved with Web-based Collaborative Learning Tools: A Randomized Field Trial,2004,2002-2006,"Bryk, Anthony",University of Chicago,Uni,Private,NCER,Grant,Effective Instruction,Efficacy and Replication,3,"$3,046,054",4 years,R305M040086,Completed,
208,Comprehensive Evaluation of the Effects of District-Wide High School Curriculum Reform on Academic Achievement and Attainment in Chicago,2006,2002-2006,"Allensworth, Elaine",University of Chicago,Uni,Private,NCER,Grant,Improving Education Systems,Efficacy and Replication,3,"$1,844,860",4 years,R305R060059,Completed,
608,Improving Postsecondary Preparation in Urban Public High Schools: An Evaluation of AVID in Chicago,2008,2007-2011,"Roderick, Melissa",University of Chicago,Uni,Private,NCER,Grant,Postsecondary and Adult Education,Efficacy and Replication,3,"$986,031",3 years,R305A080096,Completed,
371,LEAP - USA (Using Science-Based Approaches),2006,2002-2006,"Strain, Phillip",University of Colorado at Denver and Health Sciences Center,Uni,Public,NCSER,Grant,Early Intervention and Early Learning in Special Education,Efficacy and Replication,3,"$1,809,917",3/1/2006 to 2/28/2010,R324E060068,Completed,
1164,LEAP–USA Follow-up Project,2011,2007-2011,"Strain, Phillip","University of Colorado, Denver",Uni,Public,NCSER,Grant,Autism Spectrum Disorders,Efficacy and Replication,3,"$1,198,674",9/1/2011–8/31/2014,R324A110246,Completed,
1086,Project Early Vocabulary Intervention,2011,2007-2011,"Coyne, Michael",University of Connecticut,Uni,Public,NCSER,Grant,"Reading, Writing, and Language Development",Efficacy and Replication,3,"$4,097,835",4/1/11–3/31/15,R324A110135,Completed,
1351,A Modular CBT for Reducing Anxiety and Improving Educational Outcomes,2012,2012-2016,"Ginsburg, Golda",University of Connecticut,Uni,Public,NCSER,Grant,Social and Behavioral Outcomes to Support Learning,Efficacy and Replication,3,"$3,255,147",7/1/2012-6/30/2016,R324A140002,Completed,
1449,GlobalEd 2,2013,2012-2016,"Brown, Scott",University of Connecticut,Uni,Public,NCER,Grant,Education Technology,Efficacy and Replication,3,"$3,477,944",4 years (6/1/2013 – 5/30/2017),R305A130195,Completed,
1564,National Center for Research on Gifted Education,2014,2012-2016,"Siegle, Del",University of Connecticut,Uni,Public,NCER,Grant,Education Research and Development Centers,Multiple Goals,Multiple,"$5,000,000.00",5 years (10/1/2014–9/30/2019),R305C140018,Completed,
2233,Evaluating the Impact of Integrated Behavior and Reading Multi-Tiered Systems of Support in Elementary Schools,2019,2017-2019,"Coyne, Michael",University of Connecticut,Uni,Public,NCSER,Grant,Research Networks Focused on Critical Problems of Policy and Practice in Special Education: Multi-Tiered Systems of Support,Efficacy,3,"$3,999,589",5 years (07/01/2019-06/30/2024),R324N190012,In field,
1809,Supporting Strategic Writers: Effects of an Innovative Developmental Writing Program on Writing and Reading Outcomes,2016,2012-2016,"MacArthur, Charles A.",University of Delaware,Uni,Public,NCER,Grant,Postsecondary and Adult Education,Efficacy and Replication,3,"$3,245,858",5 years (7/1/2016 to 6/30/2021,R305A160242,In field,
1887,Investigating the Efficacy of a Web-Based Early Reading Intervention Professional Development Program for K-1 English Learners,2016,2012-2016,"Amendum, Steven",University of Delaware,Uni,Public,NCER,Grant,English Learners,Efficacy and Replication,3,"$3,299,115",5 years (7/1/2016-6/30/2021),R305A160255,In field,
1988,An Efficacy Follow-Up Study of the Long-Term Effects of Reading Recovery Under the i3 Scale-Up,2017,2017-2019,"May, Henry",University of Delaware,Uni,Public,NCER,Grant,Reading and Writing,Efficacy and Replication,3,"$1,099,999",3 years (08/01/2017 - 07/31/2020),R305A170171,In field,
592,Increasing the Efficacy of An Early Mathematics Curriculum with Scaffolding Designed to Promote Self-Regulation,2008,2007-2011,"Clements, Douglas",University of Denver,Uni,Public,NCER,Grant,Early Learning Programs and Policies,Efficacy and Replication,3,"$4,541,974",4 years,R305A080700,Completed,
1085,Longitudinal Study of a Successful Scaling-Up Project: Extending TRIAD,2011,2007-2011,"Clements, Douglas",University of Denver,Uni,Public,NCER,Grant,"Science, Technology, Engineering, and Mathematics (STEM) Education",Scale-Up Evaluations,4,"$1,895,857",3 years (5/1/2011-4/30/2014),R305A120813,Completed,
1722,Evaluating the Efficacy of Learning Trajectories in Early Mathematics,2015,2012-2016,"Clements, Douglas",University of Denver,Uni,Public,NCER,Grant,Early Learning Programs and Policies,Efficacy and Replication,3,"$3,453,981",4 years (7/1/2015-6/30/2019),R305A150243,Completed,
3325,Evaluating the Efficacy of an Inderdisciplinary Preschool Curriculum (EPIC),2019,2017-2019,"Sarama, Julie",University of Denver,Uni,Public,NCER,Grant,Early Learning Programs and Policies,Efficacy,3,"$3,293,767",4 years (07/01/2019-06/30/2023),R305A190395,In field,
398,Universal Cognitive-Behavioral Intervention for Elementary Students to Reduce Disruptive/Aggressive Behavior,2006,2002-2006,"Smith, Stephen",University of Florida,Uni,Public,NCSER,Grant,Social and Behavioral Outcomes to Support Learning,Efficacy and Replication,3,"$1,625,469",8/1/2006 to 7/31/2010,R324B060029,Completed,
1174,Efficacy of the BEST in CLASS Intervention for Young Children at High Risk for Emotional and Behavioral Disorders,2011,2007-2011,"Conroy, Maureen",University of Florida,Uni,Public,NCSER,Grant,Social and Behavioral Outcomes to Support Learning,Efficacy and Replication,3,"$4,134,515",8/15/2011 – 8/14/2015,R324A110173,Completed,
1619,Impact of Professional Development on Preschool Teachers' Use of Embedded-Instruction Practices: An Efficacy Trial of Tools for Teachers,2015,2012-2016,"Snyder, Patricia",University of Florida,Uni,Public,NCSER,Grant,Early Intervention and Early Learning in Special Education,Efficacy and Replication,3,"$3,498,113",4 years (7/1/2015-6/30/2019),R324A150076,Completed,
1836,Evaluating a Social-Emotional Learning Curriculum for Children At Risk for Emotional or Behavioral Disorders,2016,2012-2016,"Daunic, Ann",University of Florida,Uni,Public,NCSER,Grant,Social and Behavioral Outcomes to Support Learning,Efficacy and Replication,3,"$3,499,958",4 years (7/1/2016-6/30/2020),R324A160136,In field,
1804,Precision Education: The Virtual Learning Lab,2016,2012-2016,"Leite, Walter",University of Florida,Uni,Public,NCER,Grant,Education Research and Development Centers,Multiple Goals,Multiple,"$8,908,288",5 years (7/1/2016-6/30/2021),R305C160004,In field,
2121,Efficacy of Prime Online: Teacher Professional Development for Inclusive Elementary Mathematics Classrooms,2018,2017-2019,"Griffin, Cynthia",University of Florida,Uni,Public,NCSER,Grant,"Science, Technology, Engineering, and Mathematics",Efficacy and Replication,3,"$3,276,003",4 years (08/15/2018-08/14/2022),R324A180135,In field,
2177,Efficacy Trial of <em>I Control</em>: An Intensive Intervention to Improve Self-Regulation for Middle School Students with Emotional and Behavioral Problems,2018,2017-2019,"Smith, Stephen",University of Florida,Uni,Public,NCSER,Grant,Social and Behavioral Outcomes to Support Learning,Efficacy and Replication,3,"$3,292,300",4 years (07/01/2018-06/30/2022),R324A180042,In field,
1031,Improving the Teaching and Learning of English Language Learners: The Instructional Conversational Model,2010,2007-2011,"Portes, Pedro",University of Georgia Research Foundation,Uni,Public,NCER,Grant,English Learners,Efficacy and Replication,3,"$2,935,846",4 years,R305A100670,Completed,
129,Center for Research on the Educational Achievement and Teaching of English Language Learners (CREATE),2005,2002-2006,"Francis, David",University of Houston,Uni,Public,NCER,Grant,Education Research and Development Centers,Multiple Goals,Multiple,"$9,897,290",5 years,R305A050056,Completed,
1205,WORLD Efficacy Study,2011,2007-2011,"Gonzalez, Jorge",University of Houston,Uni,Public,NCER,Grant,Early Learning Programs and Policies,Efficacy and Replication,3,"$2,608,581",4 years,R305A140698,Completed,
1114,Scale-up Evaluation of Reading Intervention for First Grade English Learners,2011,2007-2011,"Francis, David",University of Houston,Uni,Public,NCER,Grant,Reading and Writing,Scale-Up Evaluations,4,"$5,201,997",5 years,R305A110297,Completed,
1523,Consistency Management & Cooperative Discipline (CMCD): An Efficacy Trial with Students in Third and Fourth Grade Urban Schools,2014,2012-2016,"Freiberg, Jerome",University of Houston,Uni,Public,NCER,Grant,Social and Behavioral Context for Academic Learning,Efficacy and Replication,3,"$3,496,854",4 Years (7/1/2014-6/30/2018),R305A140493,Completed,
201,Instruction Of Reading Comprehension: Cognitive Strategies Or Cognitive Engagement,2003,2002-2006,"Garcia, Georgia",University of Illinois,Uni,Public,NCER,Grant,Reading and Writing,Efficacy and Replication,3,"$1,475,400",3 years,R305G030140,Completed,
1941,Efficacy of the Connected Chemistry Curriculum,2017,2017-2019,"Stieff, Mike","University of Illinois, Chicago",Uni,Public,NCER,Grant,"Science, Technology, Engineering, and Mathematics (STEM) Education",Efficacy and Replication,3,"$3,279,937",5 years (8/1/2017-07/31/2022),R305A170074,In field,
618,"Establishing the Efficacy of the ""Special Friends"" Project",2008,2007-2011,"Ostrosky, Michaelene","University of Illinois, Urbana-Champaign",Uni,Public,NCSER,Grant,Early Intervention and Early Learning in Special Education,Efficacy and Replication,3,"$2,997,953",6/16/2008 to 6/15/2012,R324A080071,Completed,
636,Fostering Fluency With Basic Addition and Subtraction,2008,2007-2011,"Baroody, Arthur","University of Illinois, Urbana-Champaign",Uni,Public,NCER,Grant,"Science, Technology, Engineering, and Mathematics (STEM) Education",Efficacy and Replication,3,"$3,099,995",4 years,R305A080479,Completed,
643,Mindful Instruction of Nonmainstream Children,2008,2007-2011,"Anderson, Richard","University of Illinois, Urbana-Champaign",Uni,Public,NCER,Grant,Cognition and Student Learning,Efficacy and Replication,3,"$2,984,069",4 years,R305A080347,Completed,
186,Breakthrough to Literacy in the Chicago Public Schools: A Large Scale Evaluation of the Effectiveness of a Reading Comprehension Intervention,2004,2002-2006,"Hurtig, Richard",University of Iowa,Uni,Public,NCER,Grant,Reading and Writing,Scale-Up Evaluations,4,"$5,984,980",5 years,R305G040145,Completed,
724,Efficacy of the Science Writing Heuristic Approach,2009,2007-2011,"Hand, Brian",University of Iowa,Uni,Public,NCER,Grant,"Science, Technology, Engineering, and Mathematics (STEM) Education",Efficacy and Replication,3,"$4,836,057",4 years,R305A090094,Completed,
549,Class-wide Function-Based Intervention Teams: A Research to Practice Agenda for Functional Behavior Assessment (CW: FIT),2007,2007-2011,"Kamps, Debra",University of Kansas,Uni,Public,NCSER,Grant,Social and Behavioral Outcomes to Support Learning,Efficacy and Replication,3,"$2,998,625",5/1/2007 to 4/30/2011,R324A070181,Completed,
683,Center for Response to Intervention in Early Childhood,2008,2007-2011,"Greenwood, Charles",University of Kansas,Uni,Public,NCSER,Grant,Special Education Research and Development Centers,Multiple Goals,Multiple,"$10,000,000",07/01/2008 - 06/30/2013,R324C080011,Completed,
2042,The <em>Self-Determined Learning Model of Instruction</em>: Examining the Impact of Implementation Supports on Teacher and Student Outcomes,2017,2017-2019,"Shogren, Karrie",University of Kansas,Uni,Public,NCSER,Grant,Transition Outcomes for Secondary Students with Disabilities,Efficacy and Replication,3,"$3,300,000",4 years (9/1/2017– 8/31/2021),R324A170008,In field,
3354,Possible Selves and Self-Determination: Improving Transition Outcomes for High School Students with Learning Disabilities,2019,2017-2019,"Hock, Michael",University of Kansas,Uni,Public,NCSER,Grant,Transition Outcomes for Secondary Students with Disabilities,Efficacy,3,"$3,293,003",5 years (07/01/2019–6/30/2024),R324A190011,In field,
2235,Enhancing <em>Ci3T</em>: Building Professional Capacity for High Fidelity Implementation to Support Students' Educational Outcomes (Project ENHANCE),2019,2017-2019,"Lane, Kathleen",University of Kansas,Uni,Public,NCSER,Grant,Research Networks Focused on Critical Problems of Policy and Practice in Special Education: Multi-Tiered Systems of Support,Efficacy and Development,3,"$3,999,320",5 years (07/01/2019 – 06/30/2024),R324N190002,In field,
