ID,Title,Year,Year_Range,PrincipalName,PrincipalAffiliationName,Institution_Type,Institution_Sub,CenterName,FundTypeDesc,ProgramName,GoalText,Goal_3_v_4,AwardAmt,AwardPer,AwardNum,Status_Now,
782,"Improving Social-Communication, Literacy, and Adaptive Behaviors for Young Children with Autism Spectrum Disorders",2009,2007-2011,"Kamps, Debra","University of Kansas Center for Research, Inc.",Uni,Public,NCSER,Grant,Autism Spectrum Disorders,Efficacy and Replication,3,"$2,969,998",03/01/2009 - 02/28/2013,R324A090091,Completed,
1349,The Effects of Online Decision Making Support for Home Visitors Using an RTI Approach to Promote the Language Development of At-risk Infants and Toddlers,2012,2012-2016,"Buzhardt, Jay","University of Kansas Center for Research, Inc.",Uni,Public,NCSER,Grant,Early Intervention and Early Learning in Special Education,Efficacy and Replication,3,"$2,998,772",7/1/12-6/30/16,R324A120365,Completed,
1350,"A Multi-Site Efficacy Trial of the Class-wide Function-related Intervention Teams ""CW-FIT"": A Research to Practice Agency for Students With and At Risk for EBD",2012,2012-2016,"Wills, Howard","University of Kansas Center for Research, Inc.",Uni,Public,NCSER,Grant,Social and Behavioral Outcomes to Support Learning,Efficacy and Replication,3,"$2,916,059",7/1/2012 – 6/30/2016,R324A120344,Completed,
1996,The Effects of Promoting Engaging Early Literacy Interactions in Preschool Environments: Literacy 3D,2017,2017-2019,"Greenwood, Charles","University of Kansas Center for Research, Inc.",Uni,Public,NCER,Grant,Early Learning Programs and Policies,Efficacy and Replication,3,"$3,295,716",4 years (07/01/2017-06/30/2021),R305A170241,In field,
793,Evaluating the Efficacy of Enhanced Anchored Instruction for Middle School Students with Learning Disabilities in Math,2009,2007-2011,"Bottge, Brian",University of Kentucky,Uni,Public,NCSER,Grant,Cognition and Student Learning in Special Education,Efficacy and Replication,3,"$2,330,163",7/1/2009 through 6/30/2013,R324A090179,Completed,
2043,Efficacy of a Narrative Comprehension Intervention for Elementary School Children At-Risk for Attention-Deficit Hyperactivity Disorder,2017,2017-2019,"Lorch, Elizabeth",University of Kentucky,Uni,Public,NCER,Grant,Cognition and Student Learning,Efficacy and Replication,3,"$3,237,898",5 years (07/01/2017 – 06/30/2022),R305A170574,In field,
1606,Efficacy of Enhanced First Step to Success Intervention for Tertiary-Level Students with Disruptive Behavior,2015,2012-2016,"Frey, Andy","University of Louisville Research Foundation, Inc",Uni,Public,NCSER,Grant,Social and Behavioral Outcomes to Support Learning,Efficacy and Replication,3,"$3,497,001",4 years (7/1/2015–6/30/2019),R324A150179,Completed,
313,Second Step,2003,2002-2006,"Gottfredson, Gary","University of Maryland, College Park",Uni,Public,NCER,Grant,Social and Character Development,Efficacy and Replication,3,"$2,150,085",4 years,R305L030002,Completed,
1571,Effects of Enhanced After-School Programs on Educational Outcomes: A Randomized Trial,2005,2002-2006,"Gottfredson, Denise","University of Maryland, College Park",Uni,Public,NCER,Grant,Field Initiated Evaluations of Education Innovations,Efficacy and Replication,3,"$1,499,943",5 years (6/1/2005-5/31/2010),R305F050069,Completed,
1578,An Experimental Study of the Effectiveness of Instructional Consultation Teams,2005,2002-2006,"Rosenfield, Sylvia","University of Maryland, College Park",Uni,Public,NCER,Grant,Field Initiated Evaluations of Education Innovations,Efficacy and Replication,3,"$1,869,878",5 years (6/1/2005-5/31/2010),R305F050051,Completed,
2067,An Efficacy Study of Toggle Talk,2017,2017-2019,"Edwards, Jan","University of Maryland, College Park",Uni,Public,NCER,Grant,Reading and Writing,Efficacy and Replication,3,"$3,247,480",4 years (08/01/2017–07/31/2021),R305A170139,In field,
1442,Kidsteps II: Promoting School Readiness Through Social-Emotional Skill Building in Preschool,2013,2012-2016,"Upshur, Carole",University of Massachusetts Medical School,Uni,Hospital,NCER,Grant,Early Learning Programs and Policies,Efficacy and Replication,3,"$3,468,010",4 years (7/1/13-6/30/17),R305A130336,Completed,
1037,"The Efficacy of Personal Response Systems (Clickers) as Learning Tools: A Multidisciplinary, Large-Scale, Empirical Evaluation",2010,2007-2011,"Shapiro, Amy","University of Massachusetts, Dartmouth",Uni,Public,NCER,Grant,Postsecondary and Adult Education,Efficacy and Replication,3,"$504,246",3 years,R305A100625,Completed,
827,Applications of Intelligent Tutoring Systems (ITS) to Improve the Skill Levels of Students with Deficiencies in Mathematics,2009,2007-2011,"Hu, Xiangen",University of Memphis,Uni,Public,NCER,Grant,"Science, Technology, Engineering, and Mathematics (STEM) Education",Efficacy and Replication,3,"$2,322,310",4 years (7/1/2009-6/30/2013),R305A090528,Completed,
545,Improving Mathematics Performance of At Risk Students and Students with Learning Disabilities in Urban Middle Schools (MSM Project),2007,2007-2011,"Montague, Marjorie",University of Miami,Uni,Public,NCSER,Grant,"Science, Technology, Engineering, and Mathematics",Efficacy and Replication,3,"$2,085,120",6/1/2007 to 5/31/2010,R324A070206,Completed,
828,Promoting Science among English Language Learners (P-SELL): Efficacy and Sustainability,2009,2007-2011,"Lee, Okhee",University of Miami,Uni,Public,NCER,Grant,"Science, Technology, Engineering, and Mathematics (STEM) Education",Efficacy and Replication,3,"$2,999,918",4 years,R305A090281,Completed,
1239,Reading Achievement Multi-component Program (RAMP-UP),2012,2012-2016,"Calhoon, Mary Beth",University of Miami,Uni,Public,NCSER,Grant,"Reading, Writing, and Language Development",Efficacy and Replication,3,"$3,485,216",3/1/2012 – 2/29/16,R324A140003,Completed,
347,Identifying Key Components of Effective Professional Development in Reading for First-Grade Teachers and Their Students,2003,2002-2006,"Carlisle, Joanne",University of Michigan,Uni,Public,NCER,Grant,Effective Instruction,Efficacy and Replication,3,"$1,638,912",3 years,R305M030090,Completed,
957,The Impact of the Michigan Merit Curriculum and Michigan Promise Scholarship on Student Outcomes,2010,2007-2011,"Jacob, Brian A.",University of Michigan,Uni,Public,NCER,Grant,Evaluation of State and Local Education Programs and Policies,Efficacy,3,"$5,999,850",5 years,R305E100008,Completed,
930,Causes and Consequences of Public Subsidies in Higher Education: Evidence from Community College Districts,2010,2007-2011,"McFarlin Jr., Isaac",University of Michigan,Uni,Public,NCER,Grant,Postsecondary and Adult Education,Efficacy and Replication,3,"$2,573,484",4 years,R305A100369,Completed,
1323,Burst: Reading Efficacy Study,2012,2012-2016,"Rowan, Brian",University of Michigan,Uni,Public,NCER,Grant,Education Technology,Efficacy and Replication,3,"$3,243,460",4 years (9/1/2012–10/31/2016),R305A120811,Completed,
1473,Dual-Credit Courses and the Road to College: Experimental Evidence from Tennessee,2014,2012-2016,"Dynarski, Susan",University of Michigan,Uni,Public,NCER,Grant,Evaluation of State and Local Education Programs and Policies,Efficacy,3,"$2,075,729",4 years (7/01/2014-6/30/2019),R305H140028,Completed,
1519,On the Importance of School Facilities Spending to School Outcomes,2014,2012-2016,"Stange, Kevin",University of Michigan,Uni,Public,NCER,Grant,Improving Education Systems,Efficacy and Replication,3,"$2,079,385",3 years (7/1/2014–6/30/2017),R305A140363,Completed,
1539,Sustaining the Boost: Longitudinal Impacts of the Boston Prekindergarten Program and Variation in Impacts,2014,2012-2016,"Weiland, Christina",University of Michigan,Uni,Public,NCER,Grant,Early Learning Programs and Policies,Efficacy and Replication,3,"$1,419,251",3 Years (7/1/2014–6/30/2017),R305A140059,Completed,
1971,Supporting Teachers' Implementation of Data-Based Instruction in Early Writing: An Efficacy Study,2017,2017-2019,"McMaster, Kristen",University of Minnesota,Uni,Public,NCSER,Grant,"Reading, Writing, and Language Development",Efficacy and Replication,3,"$3,299,321",4 years (9/1/2017-8/31/2021),R324A170101,In field,
877,Project Construct: A Catalyst for Early Achievement,2003,2002-2006,"Thornburg, Kathy",University of Missouri,Uni,Public,NCER,Grant,Preschool Curriculum Evaluation Research,Efficacy and Replication,3,"$1,161,335",4 years,R305J030103,Completed,
915,Evaluation of a Video-Based Modeling Program to Promote Effective Teacher Classroom Management Practices,2010,2007-2011,"Reinke, Wendy",University of Missouri,Uni,Public,NCER,Grant,Social and Behavioral Context for Academic Learning,Efficacy and Replication,3,"$2,915,757",4 years,R305A100342,Completed,
1262,Evaluating the Efficacy of the School-based Social Competence Intervention for Adolescents (SCI-A) with High Functioning Autism,2012,2012-2016,"Stichter, Janine",University of Missouri,Uni,Public,NCSER,Grant,Social and Behavioral Outcomes to Support Learning,Efficacy and Replication,3,"$2,896,933",03/1/2012–02/28/2016,R324A120027,Completed,
1406,Evaluation of a Classroom Management Training Program for Middle School Teachers,2013,2012-2016,"Herman, Keith",University of Missouri,Uni,Public,NCER,Grant,Social and Behavioral Context for Academic Learning,Efficacy and Replication,3,"$2,998,403",4 years (8/1/2013-7/31/2017),R305A130143,Completed,
1750,Evaluation of a Self-Monitoring Training Program for Elementary School Students,2015,2012-2016,"Thompson, Aaron",University of Missouri,Uni,Public,NCER,Grant,Social and Behavioral Context for Academic Learning,Efficacy and Replication,3,"$3,499,927",4 years (8/1/2015-7/31/2019),R305A150517,Completed,
3329,Evaluating the Efficacy of a Daily Check-in/Check-out Intervention for Students At Risk for Emotional and Behavioral Disorders,2019,2017-2019,"Lewis, Timothy",University of Missouri,Uni,Public,NCSER,Grant,Social and Behavioral Outcomes to Support Learning,Efficacy,3,"$3,267,793",5 years (08/01/2019—07/31/2024),R324A190046,In field,
2229,"The National Center for Rural School Mental Health (NCRSMH): Enhancing the Capacity of Rural Schools to Identify, Prevent, and Intervene in Youth Mental Health Concerns",2019,2017-2019,"Reinke, Wendy",University of Missouri,Uni,Public,NCER,Grant,Education Research and Development Centers,Multiple Goals,Multiple,"$9,999,729",5 years (02/01/2019 - 1/31/2024),R305C190014,In field,
2069,Evaluation of a Training Program to Promote Effective School Leadership,2017,2017-2019,"Herman, Keith","University of Missouri, Columbia",Uni,Public,NCER,Grant,Education Leadership,Efficacy and Replication,3,"$3,290,367",5 years (08/01/2017–07/31/2022),R305A170180,In field,
1579,Evaluation of Efficacy of CBC for Addressing Disruptive Behaviors of Children at Risk for Academic Failure,2005,2002-2006,"Sheridan, Susan",University of Nebraska,Uni,Public,NCER,Grant,Field Initiated Evaluations of Education Innovations,Efficacy and Replication,3,"$1,368,067",5 years (6/1/2005-5/31/2010),R305F050284,Completed,
784,The National Center for Research on Rural Education,2009,2007-2011,"Sheridan, Susan","University of Nebraska, Lincoln",Uni,Public,NCER,Grant,Education Research and Development Centers,Multiple Goals,Multiple,"$9,997,852",5 years,R305C090022,Completed,
1253,Efficacy of the Getting Ready Intervention at Supporting Parental Engagement and Positive Outcomes for Preschool Children at Educational Risk,2012,2012-2016,"Sheridan, Susan","University of Nebraska, Lincoln",Uni,Public,NCSER,Grant,Early Intervention and Early Learning in Special Education,Efficacy and Replication,3,"$3,212,919",7/1/2012–6/30/2016,R324A120153,Completed,
1354,On the Way Home: Promoting Transition Outcomes in Youth with EBD or LD—An Efficacy and Replication Study,2012,2012-2016,"Torkelson-Trout, Alexandra","University of Nebraska, Lincoln",Uni,Public,NCSER,Grant,Transition Outcomes for Secondary Students with Disabilities,Efficacy and Replication,3,"$3,487,223",7/1/2012-6/30/2016,R324A120260,Completed,
1424,Parent Connectors: An Efficacy Study of Peer-Support for Parents of Middle School Youth with Emotional Disturbance,2013,2012-2016,"Duppong Hurley, Kristin","University of Nebraska, Lincoln",Uni,Public,NCSER,Grant,Families of Children with Disabilities,Efficacy and Replication,3,"$3,206,013",7/1/13–6/30/17,R324A130180,Completed,
1877,A Randomized Trial of Conjoint Behavioral Consultation (CBC) with Latino Students: A Replication Study,2016,2012-2016,"Sheridan, Susan","University of Nebraska, Lincoln",Uni,Public,NCSER,Grant,Social and Behavioral Outcomes to Support Learning,Efficacy and Replication,3,"$3,499,987",4 years (7/1/2016-6/30/2020),R324A160017,In field,
2202,Testing the Efficacy of INSIGHTS for Promoting Positive Learning Environments and Academic Achievement in Nebraska: A Replication Study,2018,2017-2019,"Nugent, Gwen","University of Nebraska, Lincoln",Uni,Public,NCER,Grant,Social and Behavioral Context for Academic Learning,Efficacy and Replication,3,"$3,299,957",4 years (08/01/2018 - 07/30/2022),R305A180290,In field,
883,Granite Ladders: An Experimental Evaluation of an Early Literacy Curriculum for New Hampshire's Preschoolers,2002,2002-2006,"Priest, Jeff",University of New Hampshire,Uni,Public,NCER,Grant,Preschool Curriculum Evaluation Research,Efficacy and Replication,3,"$1,339,110",4 years,R305J020051,Completed,
314,Social and Character Development in Rural Youth: The Competence Support Program,2003,2002-2006,"Farmer, Thomas","University of North Carolina, Chapel Hill",Uni,Public,NCER,Grant,Social and Character Development,Efficacy and Replication,3,"$1,797,932",4 years,R305L030162,Completed,
131,National Research Center on Rural Education Support,2004,2002-2006,"Farmer, Thomas","University of North Carolina, Chapel Hill",Uni,Public,NCER,Grant,Education Research and Development Centers,Multiple Goals,Multiple,"$17,200,000",5 years,R305A040056,Completed,
52,"Attention, Memory, and Executive Functions in Written Language Expression in Elementary School Children",2006,2002-2006,"Hooper, Stephen","University of North Carolina, Chapel Hill",Uni,Public,NCER,Grant,Cognition and Student Learning,Efficacy and Replication,3,"$1,596,398",4 years,R305H060042,Completed,
556,Comparison of Two Comprehensive Treatment Models for Preschool-Aged Children With Autism Spectrum Disorders and Their Families,2007,2007-2011,"Odom, Samuel","University of North Carolina, Chapel Hill",Uni,Public,NCSER,Grant,Autism Spectrum Disorders,Efficacy and Replication,3,"$3,019,247",7/1/2007 to 6/30/2011,R324B070219,Completed,
993,Efficacy of a Parent-Mediated Intervention for One-Year-Olds at Risk for Autism,2010,2007-2011,"Watson, Linda","University of North Carolina, Chapel Hill",Uni,Public,NCSER,Grant,Early Intervention and Early Learning in Special Education,Efficacy and Replication,3,"$2,515,897",7/1/2010 through 6/30/2014,R324A100305,Completed,
1385,The Targeted Reading Intervention: A Web-Based Professional Development Program Targeting K-1 Classroom Teachers and Their Struggling Readers,2010,2007-2011,"Vernon-Feagans, Lynne","University of North Carolina, Chapel Hill",Uni,Public,NCER,Grant,Effective Instruction,Efficacy and Replication,3,"$2,127,642",4 years,R305A100654,Completed,
1182,Advancing Social-Communication and Play (ASAP): An Intervention Program for Preschoolers with Autism,2011,2007-2011,"Boyd, Brian","University of North Carolina, Chapel Hill",Uni,Public,NCSER,Grant,Early Intervention and Early Learning in Special Education,Efficacy and Replication,3,"$3,167,682",7/1/2011–6/30/2015,R324A110256,Completed,
1277,Written Language Problems in Middle School Students: A Randomized Trial of the Self-Regulated Strategy Development (SRSD) Model Using a Tier 2 Intervention,2012,2012-2016,"Hooper, Stephen","University of North Carolina, Chapel Hill",Uni,Public,NCER,Grant,Cognition and Student Learning,Efficacy and Replication,3,"$3,106,789",4 years (3/1/2012-2/29/2016),R305A120145,Completed,
1334,Center on Secondary Education for Students with Autism Spectrum Disorders (CSESA),2012,2012-2016,"Odom, Samuel","University of North Carolina, Chapel Hill",Uni,Public,NCSER,Grant,Special Education Research and Development Centers,Multiple Goals,Multiple,"$9,994,452",07/01/2012–06/30/2017,R324C120006,Completed,
1625,An Efficacy Study of the School-based National Professional Development Center on Autism Spectrum Disorders Model (NPDC),2015,2012-2016,"Odom, Samuel","University of North Carolina, Chapel Hill",Uni,Public,NCSER,Grant,Professional Development for Educators and School-Based Service Providers,Efficacy and Replication,3,"$3,498,529",4 years (7/1/2015-6/30/2019),R324A150047,Completed,
1678,Early College High Schools at Scale: Probing Impacts and Generalizability with a Quasi-Experiment Benchmarked Against an RCT,2015,2012-2016,"Lauen, Douglas","University of North Carolina, Chapel Hill",Uni,Public,NCER,Grant,Improving Education Systems,Efficacy and Replication,3,"$799,886",3 (7/1/2015-6/30/2018),R305A150477,Completed,
1742,Educational Outcomes of the Incredible Years Small Group Program for Early Elementary Students with Self-Regulation Difficulties,2015,2012-2016,"Murray, Desiree","University of North Carolina, Chapel Hill",Uni,Public,NCER,Grant,Social and Behavioral Context for Academic Learning,Efficacy and Replication,3,"$3,496,412",4 years (7/1/2015-6/30/2019),R305A150169,Completed,
1991,An Examination of Response to Intervention in the Early Writing Skills of At-Risk Preschoolers,2017,2017-2019,"Hooper, Stephen","University of North Carolina, Chapel Hill",Uni,Public,NCER,Grant,Cognition and Student Learning,Efficacy and Replication,3,"$3,292,904",4 years (07/01/2017 - 06/30/2021),R305A170529,In field,
2168,Efficacy Follow-Up Study of the CSESA Model,2018,2017-2019,"Hume, Kara","University of North Carolina, Chapel Hill",Uni,Public,NCSER,Grant,Autism Spectrum Disorders,Efficacy and Replication,3,"$1,100,000",2 years (07/01/2018-06/30/2020),R324A180091,In field,
886,Evaluation of the Effects of Creative Curriculum on Classroom Quality and Child Outcomes in Head Start,2002,2002-2006,"Lambert, Richard G.","University of North Carolina, Charlotte",Uni,Public,NCER,Grant,Preschool Curriculum Evaluation Research,Efficacy and Replication,3,"$1,161,486",4 years,R305J020039,Completed,
1103,A Study of the Effects of a Three-Tier Model of Interagency Collaboration on Transition Outcomes for Students with Disabilities,2011,2007-2011,"Test, David","University of North Carolina, Charlotte",Uni,Public,NCSER,Grant,Transition Outcomes for Secondary Students with Disabilities,Efficacy and Replication,3,"$2,495,693",05/01/2011–04/30/2015,R324A110018,Completed,
211,Study of the Efficacy of North Carolina's Learn and Earn Early College High School Model,2006,2002-2006,"Edmunds, Julie","University of North Carolina, Greensboro",Uni,Public,NCER,Grant,Improving Education Systems,Efficacy and Replication,3,"$2,871,016",4 years,R305R060022,Completed,
1144,Follow-Up to the Study of the Efficacy of North Carolina's Early College High School Model,2011,2007-2011,"Edmunds, Julie","University of North Carolina, Greensboro",Uni,Public,NCER,Grant,Postsecondary and Adult Education,Efficacy and Replication,3,"$1,851,954",3 years,R305A110085,Completed,
1506,Impact of Early College High School (ECHS) Model on Postsecondary Performance and Completion,2014,2012-2016,"Edmunds, Julie","University of North Carolina, Greensboro",Uni,Public,NCER,Grant,Postsecondary and Adult Education,Efficacy and Replication,3,"$1,199,996",3 years (9/1/2014 – 8/31/2017),R305A140361,Completed,
1661,Improving the Educational and Social Emotional Functioning of College Students with ADHD,2015,2012-2016,"Anastopoulos, Arthur","University of North Carolina, Greensboro",Uni,Public,NCER,Grant,Postsecondary and Adult Education,Efficacy and Replication,3,"$3,179,850",4 years (7/01/2015 to 6/30/201,R305A150207,Completed,
3255,The Evaluation of Career and College Promise,2019,2017-2019,"Edmunds, Julie","University of North Carolina, Greensboro",Uni,Public,NCER,Grant,Evaluation of State and Local Education Programs and Policies,Efficacy,3,"$4,968,353",5 years (07/01/2019 – 06/30/2024),R305H190036,In field,
887,Evaluation of the Early Literacy and Learning Model (ELLM): a Curriculum and Instructional Support System,2002,2002-2006,"Fountain, Cheryl",University of North Florida,Uni,Public,NCER,Grant,Preschool Curriculum Evaluation Research,Efficacy and Replication,3,"$3,105,597",4 years,R305J020040,Completed,
1170,Evaluation of a Comprehensive Community-based Intervention for Toddlers with ASD,2011,2007-2011,"McBride, Bonnie",University of Oklahoma Health Sciences Center,Uni,Public,NCSER,Grant,Early Intervention and Early Learning in Special Education,Efficacy and Replication,3,"$2,887,900",7/1/2011–6/30/2015,R324A110353,Completed,
1338,Project DATA: A Multisite Evaluation of a School-based Model for Preschoolers with Autism,2012,2012-2016,"McBride, Bonnie",University of Oklahoma Health Sciences Center,Uni,Public,NCSER,Grant,Autism Spectrum Disorders,Efficacy and Replication,3,"$2,600,000",7/1/2012-6/30/2016,R324A120232,Completed,
518,Reading Intervention with Spanish-Speaking Students: Maximizing Instructional Effectiveness in English and Spanish,2007,2007-2011,"Baker, Scott",University of Oregon,Uni,Public,NCER,Grant,Reading and Writing,Efficacy and Replication,3,"$3,498,216",4 years,R305B077307,Completed,
599,Early Learning in Mathematics: Efficacy in Kindergarten Classrooms,2008,2007-2011,"Clarke, Ben",University of Oregon,Uni,Public,NCER,Grant,"Science, Technology, Engineering, and Mathematics (STEM) Education",Efficacy and Replication,3,"$4,280,188",4 years,R305A080699,Completed,
780,Project ECRI: Enhancing Core Reading Instruction in First Grade,2009,2007-2011,"Fien, Hank",University of Oregon,Uni,Public,NCSER,Grant,"Special Education Policy, Finance, and Systems",Efficacy and Replication,3,"$ 5,115,878",09/01/2009 – 08/31/2013,R324A090104,Completed,
813,"Summer School and Summer Learning: An Examination of Selection, Implementation, and Program Effects in a Multiyear Randomized Trial",2009,2007-2011,"Zvoch, Keith",University of Oregon,Uni,Public,NCER,Grant,Improving Education Systems,Efficacy and Replication,3,"$1,176,686",3 years,R305A090369,Completed,
1044,Middle School Intervention Project (MSIP),2010,2007-2011,"Baker, Scott",University of Oregon,Uni,Public,NCER,Grant,Evaluation of State and Local Education Programs and Policies,Efficacy,3,"$7,164,350",5 years,R305E100043,Completed,
1190,Longitudinal Follow-up of Successful Parent/Child Intervention in Pre-school Children At Risk for School Failure,2011,2007-2011,"Neville, Helen",University of Oregon,Uni,Public,NCER,Grant,Cognition and Student Learning,Efficacy and Replication,3,"$1,087,931",3 years,R305A110397,Completed,
1206,Training Attention in At-risk Preschoolers: Expansion of our Successful Program to a Wider Population within Head Start,2011,2007-2011,"Neville, Helen",University of Oregon,Uni,Public,NCER,Grant,Cognition and Student Learning,Efficacy and Replication,3,"$3,363,271",4 years,R305A110398,Completed,
1247,Team-Initiated Problem Solving for Improved Student Outcome,2012,2012-2016,"Horner, Robert",University of Oregon,Uni,Public,NCSER,Grant,Social and Behavioral Outcomes to Support Learning,Efficacy and Replication,3,"$2,523,998",03/1/2012-02/29/2016,R324A120041,Completed,
1327,A Randomized Control Trial of a Tier 2 Kindergarten Mathematics Intervention,2012,2012-2016,"Clarke, Ben",University of Oregon,Uni,Public,NCSER,Grant,"Science, Technology, Engineering, and Mathematics",Efficacy and Replication,3,"$3,338,552",07/01/2012-06/30/2016,R324A120304,Completed,
1534,Testing the Efficacy of an Ecological Approach to Family Intervention and Treatment During Early Elementary School to Prevent Problem Behavior and Improve Academic Outcomes,2014,2012-2016,"Stormshak, Elizabeth",University of Oregon,Uni,Public,NCER,Grant,Social and Behavioral Context for Academic Learning,Efficacy and Replication,3,"$3,480,268",4 years (7/1/2014–6/30/2018),R305A140189,Completed,
1622,READY for WAGES: Research on Employment of Adjudicated Youth through Working at Gaining Employment Social Skills Curriculum,2015,2012-2016,"Unruh, Deanne",University of Oregon,Uni,Public,NCSER,Grant,Transition Outcomes for Secondary Students with Disabilities,Efficacy and Replication,3,"$3,500,000",4 years (9/1/2015-8/31/2019),R324A150138,Completed,
1815,A Randomized Control Trial of a Tier 2 First Grade Mathematics Intervention,2016,2012-2016,"Clarke, Ben",University of Oregon,Uni,Public,NCSER,Grant,"Science, Technology, Engineering, and Mathematics",Efficacy and Replication,3,"$3,498,258",4 years (7/1/2016-6/30/2020),R324A160046,In field,
1879,A Multi-Site Randomized Controlled Trial to Assess the Efficacy of the NumberShire Level 1 Gaming Intervention for Improving Math Outcomes for Students With or At Risk for Math Learning Disabilities,2016,2012-2016,"Fien, Hank",University of Oregon,Uni,Public,NCSER,Grant,Technology for Special Education,Efficacy and Replication,3,"$3,499,086",4 years (7/01/2016-6/30/2020),R324A160125,In field,
1938,Evaluation of the KinderTEK iPad Math Program,2017,2017-2019,"Strand Cary, Mari",University of Oregon,Uni,Public,NCER,Grant,"Science, Technology, Engineering, and Mathematics (STEM) Education",Efficacy and Replication,3,"$3,299,986",4 years (7/1/2017-6/30/2021),R305A170044,In field,
2206,Family-Centered Intervention in Schools to Reduce Social and Behavioral Problems From Early Elementary School to Adolescence,2018,2017-2019,"Stormshak, Elizabeth",University of Oregon,Uni,Public,NCSER,Grant,Social and Behavioral Outcomes to Support Learning,Efficacy and Replication,3,"$3,299,983",5 Years (07/01/2018-06/30/2023),R324A180037,In field,
